title,main_body,link
陕西各级科协组织积极行动 投入疫情防控阻击战,陕西省科协及所属事业单位认真组织学习陕西省委关于《进一步加强党的领导 坚决打赢疫情防控阻击战的通知》，下发《关于充分发挥全省科协系统党组织战斗堡垒作用 组织动员广大科技工作者为打赢疫情防控阻击战提供科技支撑的通知》，要求全省科协系统各级党组织切实发挥战斗堡垒作用，依靠组织动员广大科技工作者为打赢疫情防控阻击战提供坚强科技支撑，做好疫情防控“应急科普”各项工作。 在“陕西科普”“水煮科技”微博、微信，今日头条，抖音等平台发布关于新冠病毒防控主题的科普文章、科普图片及科普短视频34篇，陕西科技传媒网制作网络专题报道，陕西科技报社制作“战疫情”专刊报纸，及时传播国家权威部门发布的相关信息，有针对性地进行解疑释惑和科学辟谣。使用科普中国原创试题，开展关于新型冠状病毒内容的知识战“疫”活动，通过答题让公众更加了解病毒防护知识，消除不必要的恐慌，做到科学、理智的应对疫情。陕西科技馆通过网站、微信及数字媒体平台搜集和发布权威性疫情防护科学知识进行宣传引导。通过各种渠道进行公益捐助活动，联系街办、社区配合开展疫情防控工作。 陕西省科协联合省心理卫生协会整合全省资源，组织经验丰富的精神科医师或心理咨询师通过电话热线为公众提供免费心理援助。省医学会积极协调省侨联向陕西新型冠状病毒感染疫情防控指挥部捐献口罩等物资。开通“陕西医学科普”公众号，制作新型冠状病毒感染肺炎防治的专题栏目。省药学会发布倡议书，发动会员单位开展针对新型冠状病毒的研究，组织会员单位、企业向武汉及陕西的各大医院捐赠口罩、防护服等医疗物资。省康复医学会动员学会会员根据疫情编写防护疫情的科普文章。省预防医学会向陕西省和西安市、宝鸡市、咸阳市、安康市疫情防治机构提供专业技术咨询20余条，通过网络发布4篇预防专业及科普文章，向全省医务工作者发布慰问信，向会员单位提供预防控制、诊断、病例定义界定等专业咨询服务。省护理学会、省营养学会、省心理卫生协会等发布应急科普文章10余篇。,http://www.cast.org.cn/art/2020/2/2/art_80_109667.html
宁夏科协系统迅速行动广泛宣传助力疫情防控,近期，针对新型冠状病毒感染的肺炎疫情，宁夏科协提高政治站位，扎实做好新型肺炎疫情应急科普宣传工作。各市县区科协充分利用网络传播优势，调动科普中国 APP 信息员和“三长”作用， 大力推送疫情应急权威科普知识。 1 月 22 日，宁夏科协召开专题会议，安排部署疫情防控应急科普工作，并加强与全区学会、权威专家联系，建立联动机制，及时发出权威声音。充分利用宁夏三农呼叫中心平台及“科普中国?宁夏全媒体传播云平台”，彩宁夏电视频道、APP、微信公众号，宁夏教育电视台 “科普大篷车”、宁夏微科普公众号等开展应急科普。 各市县区科协在地方党委政府领导下，迅速建立应急科普机制，组织动员开展新型冠状病毒感染肺炎疫情应急科普宣传。五市科协及时印发通知，制定新型肺炎疫情防控应急科普宣传工作实施方案，发出《致全市科技工作者的倡议书》，号召全市各级科协组织和广大科技工作者要更加积极地行动起来，充分发挥科学的力量，全力以赴做好疫情防控工作。兴庆区、西夏区、贺兰县、永宁县、灵武市、利通区、同心县、红寺堡区、青铜峡市、盐池县、中宁县、西吉县、彭阳县、隆德县、泾源县等科协充分利用科普大篷车、微信公众号、LED 科普信息屏、科普信息员群等渠道，进行新型冠状病毒防控科学知识的普及宣传。截至1月 31日15时，各市县区科协利用微信公众号、微信群等推送科普文章 2000 余篇，科普信息员传播科普中国文章数量近 15 万余篇，覆盖人群 50 万人次。 银川市康复医学会深入兴庆区 38个社区开展志愿服务活动。银川市针灸学会积极配合挂靠医院(银川市中医医院)做好一线的诊疗工作，在高速路口、机场、火车站设卡堵疫工作，在社区摸排工作宣传普及疫情防控科普知识。银川市心理咨询师协会开通疫情心理咨询热线服务，接听回答心理咨询电话，在宣传防控疫情科普知识的同时，为部分市民做紧急心理危机干预。银川市护理学会完成了对紧急调配的 40 名护理人员进行防护服穿脱培训和考核，完成赴武汉第二梯队人员、第三梯队普通组人员、第三梯队危重症组人员的信息登记。银川市科技志愿青少年科技教育服务队面向全市初三毕业生捐助网课，免费开放“超级课堂”，配合银川市教育局应对学生停课不停学。宁夏护理学会精神心理专委会安排了14名取得心理咨询师、心理治疗师资质的护理人员 24 小时坐席接听咨询，热线专家为来电咨询人员缓解焦虑、稳定情绪、增强心理免疫力、宣传防控病毒科普知识，减少发生感染发挥作用。,http://www.cast.org.cn/art/2020/2/1/art_80_109585.html
河南科协：应急科普重点应对农村聚集性传染防治工作,面对严峻的新型冠状病毒引发的肺炎疫情防控形势，河南省科协结合实际，把农村聚集性传染的防治工作作为当前应急科普工作的重中之重，一手抓科普资源传播分享，一手抓防疫知识普及宣传。2月1日，河南省科协把“科普中国新型冠状病毒相关资源”下载转发到全省18个省辖市、158个县市区科协和148个重点全省学会，供各地各单位免费下载使用；组织全省7000多个农技协、1000余个智慧农技协、300个农村电商技能人才培训基地（科技扶贫基地）、800个农村电商示范店铺、61个现代农业科普园共下载转发科普中国新型冠状病毒感染肺炎科普知识视频、资料3万余次，全省300余万农民受益；指导全省53个农村中学科技馆以班级为单位，利用微信群、校讯通等，下载转发科普中国新型冠状病毒感染肺炎科普知识视频、资料800余次，为全省6.5万余名农村中学师生营造了良好的“一起行动抗病毒、学习健康两不误”的氛围。动员全省3000多个科普中国大屏管理员、1000多个农村电商技能人才培训师、5000多个农技协专家团专家、3500多个科普中国信息员及时下载转发科普中国新型冠状病毒感染肺炎科普知识视频、资料10余万次，覆盖农村人口600余万。,http://www.cast.org.cn/art/2020/2/1/art_80_109584.html
江苏省科协：群策群力打好抗击疫情科普宣传战,新型冠状病毒感染的肺炎疫情发生以来，江苏省各级科协组织在省委省政府领导和中国科协指导下，担当尽责、形成合力、群策群力打好抗击疫情科普宣传战。1月29日，江苏省科协发出倡议书，号召全省科技工作者坚定必胜信念，弘扬科学精神，用好科技武器，用科学精神和科技武器打赢防治新型冠状病毒肺炎疫情阻击战。省科学传播中心汇总《科学预防新型冠状病毒肺炎》《科普中国|防病毒如何戴好口罩》视频在人民网江苏频道、公众科技网、江苏省科协、苏科家园、科学传播在线、科普云大屏终端、慧科网和南京地铁移动电视平台等多个平台发布，同时推送有关疫情防治及辟谣资讯207条，阅读超过115.8万人次。科学少年社平台开展了“武汉加油”――江苏科技小记者参与疫情防控作品征集活动，用文字、画笔或镜头表达抗击疫情的信心，歌颂医护人员无私大爱的奉献，征集小记者作品30多件，从1月30日开始择优陆续发布宣传。江苏省科协所属省级学会（协会、研究会）除发动会员及时宣传疫情科普知识外，还结合各自专业特点及时发布针对性的科普信息。江苏省预防医学会发挥专业优势，及时发布专业疫情防控科普信息，在网站和微信平台推出电子版宣传资料。江苏省环境科学学会发布《使用过的废口罩要怎样处理才合适》和《抗击新型肺炎疫情》倡议书，号召遵守疫情防控各项制度规定，鼓励通过正规渠道进行物资捐赠。江苏省农村专业技术协会对全省各级农技协组织发出《关于做好新型冠状病毒感染的肺炎疫情防控应急科普工作的函》，提出工作要求。协会微信公众号发布有关疫情防治及辟谣资讯13篇。江苏农村专业技术网开辟科普专栏，发布科普图文9篇。在“科普农服通”、“问农答”App等科普服务平台上发布相关信息，在全国3000多台科普农服通设备上植入科普中国内容，每天动态分享科普视频、科普图文等，辐射全国23个省份。江苏省科普作家协会理事长单位凤凰出版传媒集团、江苏凤凰科学技术出版社紧急召开会议，邀请南京鼓楼医院传染病学科相关专家迅速编写、紧急发布了《新型冠状病毒感染的肺炎防护手册》（网络电子版）。,http://www.cast.org.cn/art/2020/2/1/art_80_109580.html
广西科协系统线上线下协同“抗疫”,当前，全面防控新型冠状病毒感染肺炎疫情进入关键时期。广西科协建立应急科普工作机制，统筹指导自治区科协系统所属的各类媒体平台，线上线下协同并进，打响应急科普“主动仗”。线上在全自治区550多个科普e站发布56个新型冠状病毒感染的肺炎疫情应急科普宣传素材，累计阅读量超过2.5万人次。利用自治区科协所属微信公众号编发推送科普图文，累计阅读量近3万人次；广西科协今日头条号发布科普图文累计阅读量近15万人次，几百个科普工作群，多个科普APP、气象科普大喇叭等新媒体同步深入开展应急科普工作，并与电视台合作，定点播出“抗疫”科普信息。线下在《南方科技报》和《医药星期三》出版2个防范新型冠状病毒科普专版，发行覆盖自治区乡镇农村、城市社区等，广大读者受众总计约10万人。在全自治区人员流动大的客运站、城市广场、公交车、社区入口等场所的LED科普信息屏、科普宣传展板广泛宣传疫情科普信息，并结合科普大篷车、专题科普活动等宣传载体，将宣传面由城市延伸至乡镇农村，力求信息传播全覆盖。,http://www.cast.org.cn/art/2020/2/1/art_80_109578.html
江西省科协系统众志成城 全力打赢疫情阻击战,面对这场新型冠状病毒感染的肺炎疫情，近日来，江西省科协系统迅速行动，积极作为，大力宣传普及肺炎疫情防控知识。 全媒体　多渠道　应急科普强力发声 “科普江西”微信公众号、抖音号发布优质科学权威科普资讯、视频，供基层科协下载转发分享。江西省科协主办“预防感染新型冠状病毒科普知识网络竞赛”，开赛后48小时内，参赛人员覆盖全省100各县（市区），参赛人次达38万。江西全省11个设区市科协通过微信公众号、电视台、报纸、宣传栏等平台，发布转发权威科普信息6000余篇条，阅读量300万余人次，发放张贴宣传单10万份。 九江市科协多种渠道形式推送涵盖国家决策部署、政策权威发布、专家解读、知识解答等多方面的防控知识，点击量超过70万人次。萍乡市科协利用多个平台专题宣传肺炎疫情科普知识。积极组织群众参加省预防感染新型冠状病毒网络知识竞赛。新余市科协在“2020年新余市迎新年学科学”微信有奖竞答活动中，加大普及疫情防控知识，通过科普中国社区、学校、乡村e站头条推送疫情防控知识。上饶市科协在“大美上饶”、上饶日报等微信公众号平台，精准推送权威疫情防控知识。鹰潭市科协通过科普e站、户外科普显示屏、网站、微信公众号等，积极推送“科普中国”优质权威科普资源。吉安市科协依托吉安市广播电视台《科普中国》V视频栏目、《井冈山报》和网络新媒体等平台进行互动式传播。抚州市科协利用信息化手段和通过基层科普阵地，深入集市、超市、车站、社区等传播应急科普内容。 进基层　入社区　应急科普覆盖家家户户 江西全省11个设区市科协发动各级学会，以及近20000名基层“三长”、科技服务志愿者、科普信息员开展各种形式应急科普。景德镇市科协组织科普志愿者进社区粘贴宣传单，入户宣传。除夕当天入户3000家，粘贴发放宣传单近万份。动员基层“三长”、农技协向会员、农民推送宣传应对疫情科普知识，宣传资料、信息传送到163个“三长”和160个基层农技协。上饶市科协广泛动员12个县科协、150余名基层科普信息员参与科普宣传。鹰潭市科协动员基层“三长”150余人、科技服务志愿者400余人、科普信息员1000余人参与应急科普，以社区、村为重点发放宣传单30000余份。 吉安市科协加强与相关学会、企业科协、院士工作站的联系，督促科普示范基地、农技协开展应急科普。赣州市科协在全市46台科普e站终端宣传疫情防控知识，积极动员乡镇科协、基层“三长”等开展科普宣传。,http://www.cast.org.cn/art/2020/2/1/art_80_109573.html
中国科协再次倡议：让科学家精神光耀时代 让科技创造新的价值,新冠肺炎疫情发生以来，科技界坚决贯彻落实习近平总书记重要指示精神，在党中央、国务院坚强领导下，紧急行动、全力奋战、众志成城，为打赢疫情防控阻击战提供了强有力的科技支撑。为夺取疫情防控和实现经济社会发展目标的双胜利，中国科协向全国学会（协会、研究会）、各级科协组织和广大科技工作者再次倡议：一、砥砺学风，勇担重任。斩断疫情，科技铸剑。振兴经济，科技当先。广大科技工作者要坚守“心有大我、至诚报国”的光荣传统，坚定信心，实事求是，尽出所学，各展所长，汇聚成共度危机、共谋发展的科技志愿服务大军，让知识服务社会，让科技支撑发展，让科学家精神光耀时代。二、问题导向，需求牵引。聚焦企业复产的关键领域，精准把握产业发展的痛点堵点，破解发展瓶颈，攻克“卡脖子”问题，在协同攻关中提升自主创新能力。以数字化网络化智能化重构生产、经营、管理流程和模式，提升产品服务能力，在解决实际难题中彰显科技力量，在推动高质量发展中成就科技价值。三、产学融合，创新发展。协同解决重点领域、重点产业的关键短板问题，推动企业转型升级、提质增效。引导龙头企业以技术优势辐射中小企业，形成规模效应，推动形成产业集群和产学跨界机制，帮助中小企业渡过难关。激发创新创业创造生机与活力，释放产业转型发展新动能。四、平台支撑，精准施策。充分发挥科技智库作用，为产业发展、生态优化和治理现代化提供有效政策建议。搭建跨学科供需对接平台，实施精准服务，推动企业高质量发展。有效开展“百城千会万企”助力行动，组建“科技服务团”，为企业成长和区域经济振兴提供解决方案。五、开放团结，合作共赢。科学无歧视，发展无止境。增强跨越国界的相互理解、相互信任和相互支持，深化国际间科技合作，秉持开放共享，凝聚发展共识，尊重知识产权，助力企业融入全球创新网络。战“疫”必将胜利，发展时不我待。国家和人民的需要就是科技界的集结号。希望广大科技工作者大力弘扬爱国、创新、求实、奉献、协同、育人的科学家精神，躬行社会责任，把论文写在祖国大地上，让科技在经济社会发展中创造新的价值。,http://www.bast.net.cn/art/2020/2/27/art_23312_449905.html
马林书记到北京科学中心调研,当前，新冠肺炎疫情防控工作压力未减，为进一步做好北京科学中心疫情防控与推进科普工作两手抓，2020年4月1日，市科协党组书记马林同志带队赴北京科学中心调研，调研中，就持续做好疫情防控工作、统筹推进科学教育课程开发等进行检查、听取汇报，并召开专题座谈会。党组成员、副主席刘晓勘，市科协二级巡视员陈维成一同调研。通过实地考察，马林充分肯定北京科学中心积极落实市委市政府疫情防控各项要求，在保障疫情防控安全过程中，持续坚持做到进馆人员测体温和信息登记，楼宇清洁消毒、加强驻场人员健康日报告等疫情防控各项措施。在北京科学中心“三生”主题馆的特色专区，马林书记一行听取了基于“小球大世界”展项开发的特色科学教育――《我们的海洋》课程讲解，他鼓励中心党员干部要充分利用小球多媒体技术呈现科普资源的优势，以公众需求为导向，有针对性的策划科学教育活动。他强调，要以“小球大世界”特色展区的打造为契机，完善科学中心科学教育活动资源建设和运行机制。要通过深入挖掘“小球大世界”展项本身的特点，开发和建设不同系列、不同层次、不同风格、多样化的“馆-校结合”课程体系，将抽象、复杂的科学原理转变成直观、简单的现象和实践，引导公众透过现象看本质、寻求问题解决思维和能力。,http://www.bast.net.cn/art/2020/4/3/art_23312_457583.html
京台科技成果线上路演活动成功举行,3月26日，京台科技成果线上路演活动成功举办。本次活动充分发挥京台青年科技工作者联席会议机制，依托北京市科协科技成果转化服务平台，围绕“需求侧引领、供给侧发力、服务侧助力”的科技成果转化服务体系架构，以视频直播连线的方式，把两岸科技成果与产业需求相对接，为双方提供精准服务，深化两岸科技交流和产业发展务实合作。市科协第九届国际暨港澳台工作委员会委员、中关村天合科技成果转化中心主任朱楠主持路演会。项目路演环节展示了来自台湾水木清华校友会推荐的6项先进、实用、成熟技术，涉及生物医药、现代农业、新材料等领域。洪瑞鸿介绍了“β-烟酰胺单核苷酸”实用性开发技术对修复受损DNA、提升细胞免疫等方面的重要作用。杨士模发布的癌症指针荧光编码检测微流控分析仪，可在IVD（体外诊断）精准医疗领域，提供智能解决方案，并可用于癌症、冠状病毒等小分子检测。林昆仪发布的高精度实时显真智能血压监护平台，可稳定测量不同状态下不同人群及动物的血压。顾涵谅发布的有机肥快速转化技术，利用生物有机肥解决农业废弃物快速处置及土壤贫瘠化问题。连宏清发布的氢科技乐活养生工程系统，利用氢气抗氧化作用促进受众拥有更加健康的身体，同时介绍到钟南山院士参与指导氢氧疗法，通过氢氧混合气吸入来治疗新冠肺炎患者的缺氧和低氧症状。直播间内留言踊跃、反馈积极。中关村天合科技成果转化工程院院长朱希铎表示，来自台湾的6项科技成果都具有核心关键技术，并且具有较高的产品化程度和成熟的商业化程度，希望台方抓住大陆庞大市场空间和强有力的资源配置条件，尽快将科技成果产业化落地。市科协科技成果转化服务平台也将继续深入跟进，在解答疑问的基础上积极推动项目对接，促进科技成果的深度转化，用细致全面的服务为科技成果供需双方提供解决问题的方案。活动由北京市科协指导，中关村天合科技成果转化促进中心主办，北京京台科技创新合作促进会、台湾水木清华校友会研究发展中心承办、首都金融服务商会协办。市科协副主席田文，交流部长曾福林，以及来自产业园区、科研机构和相关企业的代表在线参加了此次活动。,http://www.bast.net.cn/art/2020/3/30/art_23312_455383.html
市科协看望慰问驻村第一书记,3月23日，北京市科协党组成员、副主席田文看望慰问密云区十里堡镇岭东村驻村第一书记及村两委委员，并代表市科协送去新冠肺炎防疫急需物品160余件，为岭东村疫情防控工作提供有力支持。田文在认真听取和了解岭东村疫情防控工作后，对驻村第一书记工作给予了充分肯定。自全国开展新冠肺炎疫情防控工作以来，第一书记坚持61天的“长跑”，积极协调密云区科协、北京农学会、北京食品学会、北京烹饪协会等，通过发放科普手册、专家建议、行业倡议书及防疫指导意见等多种方式，提升村民防疫意识和科学知识水平，为村民及复工复产企业提供专业帮助，取得了阶段性工作成效。田文指出，要继续发挥驻村第一书记作用，找准定位、勇于担当，带领干部群众切实将“外防输入、内防扩散”严到底。同时，也要做好自身防护，全力以赴守好村居防线。田文强调，村居作为疫情防控工作第一道防线，要按照北京市和密云区新冠肺炎疫情防控工作领导小组工作部署要求，进一步加强村卡口规范化、防控队伍专业化建设，不断强化村民联防联控工作机制，切实保障好村民的生命安全和身体健康。机关党委专职副书记张晓华、北京科技社团服务中心主任张鸿博一同参加慰问。,http://www.bast.net.cn/art/2020/3/25/art_23312_454441.html
北京市科学技术协会抗击新型肺炎疫情倡议书,新型冠状病毒感染的肺炎疫情发生以来，习近平总书记多次作出重要指示，党中央、国务院对做好疫情防控工作、打赢疫情防控阻击战提出了明确要求。北京市委市政府迅速落实中央部署，果断启动重大突发公共卫生事件Ⅰ级响应，形成了全民防控、人人动手的良好局面。首都广大科技工作者特别是医务工作者不畏艰险，奋勇逆行，对防控新型冠状病毒感染肺炎发挥了积极的重要作用，充分展现了首都科技工作者的责任和担当。目前，春节后返京人流即将到来，防疫工作到了紧要关头，为认真贯彻落实中央及市委市政府的决策部署，充分发挥科协系统的组织优势和科技工作者的关键作用，坚决打赢疫情防控阻击战，特提出如下倡议：一、提高政治站位，切实把思想和行动统一到党中央、国务院决策部署上来。坚决贯彻落实习近平总书记重要指示精神，增强“四个意识”、坚定“四个自信”、做到“两个维护”，进一步增强疫情防控工作的紧迫感和责任感。按照坚定信心，同舟共济，科学防治，精准施策的要求，坚定不移把中央的决策部署落到实处，科学判断形势，精准把握疫情，用实际行动弘扬抗击疫情正能量，坚决打赢这场没有硝烟的疫情防控战。二、加强科技攻关，在疫情防控战斗中建功立业。要充分发挥科协组织优势，把疫情防控工作作为当前最重要的任务，市科协所属学会和科技工作者要主动担当作为，团结协作，集智攻关，为打赢疫情防控战发挥科技支撑作用。要密切关注有关疫情动态信息，通过正常渠道及时提出有针对性、切实管用的意见建议和方案，为阻击新型肺炎提供科技智慧。医口学会要主动发挥优势，积极投入疫情防治工作，通过多种方式积极开展疫情防治宣传，为一线医务工作者做好服务保障。三、积极履行职责，大力普及科学防控疫情知识。积极组织动员社会科普资源，为社会公众提供科学权威、通俗易懂的优质科普产品。统筹利用各类媒体渠道，积极宣传报道疫情防控的工作进展、有效经验和科研成果，弘扬疫情防控正能量。通过科普文章、视频、互动知识竞答等多种形式传播疫情防控知识，教育引导广大群众增强防护意识，防止谣言传播，理性科学防控，维护社会稳定。四、坚持以身作则，带头遵守疫情防控各项制度规定。科技工作者是科学知识、科学精神的传播者、引领者，要以身作则，带头学习疫情防控知识，做好个人防护，并帮助指导亲朋好友和群众严格落实戴口罩、勤洗手等疫情防护措施。要带头减少不必要的外出活动，不串门、不集会、不聚餐，不去人员密集场所，有效切断病毒传播途径。要带头践行健康生活方式，依靠科学、履行责任。,http://www.bast.net.cn/art/2020/1/31/art_23312_448924.html
