title,main_body,link
河南省领导作出批示肯定省科协疫情防控工作,日前，河南省副省长霍金花在河南省科协报送的《关于新型冠状病毒感染的肺炎疫情防控应急科普阶段性工作情况的报告》及《关于新型冠状病毒肺炎疫情全省学会科学防控阶段性工作情况的报告》上作出批示，向奋战在防控一线的各级科协组织和学会表示崇高的敬意！希望省科协继续发挥好组织优势，在下一步全省疫情防控阻击战中，带领广大科技工作者在救治、科研、科普及科技创新中“听党话、跟党走”，弘扬科学精神，传播科学声音，汇聚正能量，为打赢防控阻击战贡献智慧力量。 自新冠肺炎疫情发生以来，河南省科协充分发挥各级科协组织优势和所属省级学会智力密集、联系广泛优势，结合疫情防控需求，建立健全应急科普工作机制，打造科学防疫学会工作体系，助力河南省疫情防控工作。 河南省科协坚持把疫情防控工作作为当前最重要的工作来抓，制定《河南省科协新型冠状病毒感染的肺炎疫情防控应急科普工作方案》，成立应急科普工作领导小组，建立应急科普工作机制。发出《关于组织动员科技工作者深入开展防控新型冠状病毒感染肺炎疫情的通知》《全省科技志愿者积极参与疫情防控的倡议书》和《关于抗击新型冠状病毒感染肺炎疫情期间科学有序开展学会工作的通知》，指导17个省辖市和济源示范区科协、省级学会按照统一部署，积极组织科技工作者投身一线、发挥专业优势，为疫情防控做贡献。 聚焦热点，强化正面宣传引导。充分利用线上渠道，普及防疫科学知识和有效方法，解疑释惑，不断增强公众自我防护意识，提高公众的疫情防控能力。河南省科协联合省卫健委举办中原科普讲坛，邀请权威医学专家宣传疫情防控知识。在大河网、央广网河南频道开辟“科学防护 共同抗‘疫’”专栏，推送权威防疫科普知识和疫情动态信息，转发权威科普视频、文章，点击量超过1000万次。全省55个科普信息化试点县利用建成的2000多个科普大屏、乡村大喇叭，滚动播出防疫科普节目。 群策群力，提出科学防疫建议。发挥科协为党和政府科学决策服务职责，组织省级学会专家团队提出科学防疫建议，先后报送《新型冠状病毒肺炎时期的河南民众心态调查》《关于对收治新型肺炎病人定点医院真空泵房检查的建议》《科学应对，联防联控，战胜疫情-防控新型冠状病毒肺炎十条倡议》等调研报告和建议，为河南省防疫提供决策参考。 开展公益捐助，全力支援防控一线。推动科普资源服务向基层下沉，号召社会各界积极捐献物资支援疫情防控一线，充分发挥省级学会联系广泛优势，动员会员单位和广大会员捐赠防疫物资。争取中国科协支持。,http://www.cast.org.cn/art/2020/2/19/art_80_113138.html
巩固成果 强化措施 上海市科协应急科普助力防“疫”保卫战,目前返程客流逐步增大、企业陆续复工、城市运行逐渐回归常态，给防控疫情带来更大考验。上海市科协应急科普工作着力巩固成果、夯实措施，以更加积极主动的状态投入防“疫”保卫战。由上海市科协与东方广播中心联手打造的《十万个为什么》抗疫科普节目整合近期疫情防控内容，特别剪辑9期听众关心的系列知识短音频，多角度、多学科邀请科学观察员给听众科普与疫情相关的知识。围绕时下最关心的口罩、消毒液话题，制作了“最详细的口罩和防护服科普”“消毒用品你用对了吗？”专题内容；从了解病毒从哪里来、认识病毒与人类关系等角度，制作了“野生动物存在哪些危险，如何把病毒传染给人类”“人类与疫情搏斗史”“什么是病毒”“疫苗是如何研制的”等专题内容，让广大市民从科学角度认识疫情、抵御病毒。节目音频在阿基米德app新媒体端进行二次传播，发布仅2天，浏览量超126万。2月13日，上海市科协微信公众号转发了《Nature》杂志论文《经历过埃博拉和H1N1的医生呼吁考虑三组决策护医护人员周全》。截至2月14日，上海市科协微信微博共更新与疫情相关的科普内容近250条。智慧科普盒子上海地区推送疫情防控权威科普内容1572条，播放2997347次，相关科普视频9103小时；向兄弟省市推送疫情权威科普内容1044条，播放1998165次，相关科普视频5896小时。上海科普网聚合权威来源与疫情相关的科普内容2502条，包含应急科普视频213部。上海科技报社从战“疫”要闻、科研一线、医护驰援、城区行动、现场直击、企业护航、健康免“疫”等不同角度采写稿件，目前共发布4期特刊，共20个版面；编写完成《冠状病毒防治宣传册》第4期，重点向市民科普上下班期间，在工作区域如何防护；报社微信公众号“科技会客厅”开设“方舱纪实”，与同济大学附属东方医院国家紧急医学救援队联合推送前方动态；微信公众号“动手做报”发布首期线上科学实验微视频，后续将持续跟进。,http://www.cast.org.cn/art/2020/2/18/art_80_112889.html
浙江省领导肯定省科协应急科普宣传有效助力全省疫情防控工作,2月16日，浙江省副省长高兴夫在省科协报送的《关于积极组织开展新型冠状病毒防控应急科普宣传的报告》上作出批示，充分肯定省科协充分发挥“一体两翼”的作用，多管齐下开展应急科普宣传，有效助力浙江省疫情防控工作。浙江省科协党组书记、副主席、新型冠状病毒感染的肺炎疫情防控工作领导小组组长郑金平收到批示后要求，务必落实好批示精神，广泛动员社会力量，充分发挥科学传播融媒体联盟优势和纲要成员单位作用，重在落实，谋划长远，继续做好公众应急科普，探索建立应急科普长效机制，有效助力浙江省疫情防控工作。自疫情发生以来，浙江省科协迅速行动，多管齐下，紧紧抓住疫情防控中科普工作的着力点，有效发挥科普作用。一是打造全媒体科普。1月24日迅速启动浙江科学传播融媒体联盟应急科普联动机制，利用报纸、广播、公众号、APP、家庭电视等多渠道，从科普中国、人民网等权威平台筛选优质文章进行推送，全方位战“疫”。二是专业科普，精准阻击。从早期科普“普通肺炎与新冠肺炎的区别”“如何戴口罩”到“做好疫情下的心理防护”“针对‘三返’人员的科普”再到“杭州健康分类预防指南”，省科协跟随疫情变化做好相应的科普，充分发挥各级学会、科技工作者的作用，积极配合全省疫情防控工作部署。三是抓好农村、社区等关键区域关键人群科普。主动联系省委宣传部在“礼堂家”平台上线科普防疫专区，上传挂图折页以及相关视频，利用华数家庭电视同步设置科普专栏走进千家万户。截至目前，已赶制21万套折页寄送到全部县市区，鼓励基层科协工作人员主动参与联防联控的同时做好科普宣传工作。,http://www.cast.org.cn/art/2020/2/18/art_80_112889.html
云南省科协发挥科普矩阵优势开展疫情防控应急科普,自新型冠状病毒感染的肺炎疫情发生以来，云南省科协及时制定应急科普工作方案，直属单位省科普资源信息中心和《奥秘》画报社迅速行动，利用省科协新媒体矩阵，动员全省109282名科普信息员投入到抗击疫情应急科普宣传工作中。 1月19日，省科协官方微信公众号“美丽云南微科普”转发了权威媒体发布的关于新型冠状病毒感染肺炎的科普辟谣文章，随着疫情的逐渐发展，省科协发布科普信息加大了对这一话题的关注度。 1月22日，云南省科协统筹利用传统媒体和新媒体各类传播渠道，转发防疫有关政策和科普中国APP开通的“防控新型肺炎 让春节更祥和”专题内容。 截至2月15日，云南科协网开设了“防疫科普”专栏和“众志成城、抗击疫情”专题，省科协官方微信公众号发布了23期关于新型冠状病毒感染的肺炎疫情的科普内容，共有111篇图文稿件，阅读总数达20877人次，转发分享12488人次。省科协官方微博共转发科普中国相关文章68篇，发布地方科协原创稿件134篇，参与疫情防控相关话题4个，微博阅读总数49.19万人次。在“云南科协”今日头条号上发布“科普中国”关于疫情防控科普知识的相关文章74篇，省内地方科协原创稿件122篇，阅读总数36.2万人次。“云南科协”抖音号转发“科普中国”抖音号视频93条。更新科普宣传栏内容，发布《冠状病毒科普挂图》4幅、《疫问医答系列》8幅、《冠状病毒知识辟谣挂图》8幅，宣传挂图1幅。 《奥秘》画报社微信公众号“奥秘真相工厂”通过专家访谈、权威解答，普及科学防控知识。邀请专家编辑发布了《邻居在家隔离观察，我开窗病毒会飘进来吗？宅在家中，我们还要注意些什么？》《出门晒太阳，可以杀死新型冠状病毒吗？》等一系列科普文章。发布了原创科普文章《确诊患者粪便中检测出病毒，从医学上讲，意味着什么？当如何防护应对？》《抗疫为什么需要康复者血浆？抗体！抗体！抗体！》等。 春节前后，云南省科协主办的美丽云南科普报针对疫情防控出版了2期专刊，开设了“传播途径”“个人卫生”“行为指南”“政策措施”“卫士在前”“正道声音”“居家锻炼”等专题版块，紧急印制10万份发放到全省各级科协和行政村、社区街道办，为基层开展疫情防控宣传工作提供保障。,http://www.cast.org.cn/art/2020/2/18/art_80_112800.html
湖南省科协持续扎实工作 助力打赢疫情防控阻击战,湖南省科协贯彻落实中央、省委省政府和中国科协部署，积极主动发声发力，助力打赢疫情防控阻击战。湖南省科协动员全省1.3万个科协组织和2.7万名科技志愿者积极开展“抗疫情，稳生产”科技服务活动；联合省内40家种子企业作出保障春耕生产种子供应承诺，组建120名在线农技服务团、畜禽养殖技术服务专团，线上线下为稳定生产提供科技支撑；寻找“最美防控战士”，宣传抗疫一线先进典型，捐款捐物支援抗疫。通过互联网、“村村响”、电子屏、车载流动大喇叭、宣传标语、宣传橱窗等方式，进农村、入社区向群众开展网格化科普宣传，全省科协系统科普网络平台体系发布与传播科普信息13.7万条，访问量达1660万人次。130多家中央和省内媒体刊发或转载科普湖南融媒体中心发布的科普信息。征集发布20条疫情防控科普标准化标语，使用达4.2万条次。组织编撰《新型冠状病毒肺炎大众防护与心理疏导》《新型冠状病毒感染的肺炎防控知识100问》《新型冠状病毒感染的肺炎校园防控手册》系列科普读物电子书，通过科普中国、学习强国湖南平台等媒体及省教育厅、卫健委向社会推介，阅读和下载量达100万。开展心理援助咨询，建立全国应对疫情心理援助热线平台，援助对象460余人，培训心理援助志愿者300余人。加强涉科谣言监测，组织专家网络辟谣，发布辟谣信息41条。以赛促学、以学促用，科普湖南推出《防疫知识知多少》网络问答，每日发布4道题，参与答题12.1万人次。,http://www.cast.org.cn/art/2020/2/17/art_80_112608.html
?科协人战“疫”时刻，中国科学技术出版社：冲锋在科学战“疫”前线,岁末年初，新型冠状病毒肺炎疫情警报拉响，全国人民迅速投入到疫情防控的战斗中。与此同时，关于新冠肺炎的流言四起，真假难辨。不少民众因为对相关科学知识的不了解而放松警惕或过于恐慌。普及疫情防控科学知识、澄清谣言、纾解公众恐慌心理，迫在眉睫。正当此时，作为出版人，中国科学技术出版社有限公司（以下简称中国科技出版社）全体职工冲在了疫情科普前线。在中国科协党组书记处的统一领导部署下，在中国科协科普部、调宣部、学会部的直接指导下，他们在第一时间作出反应，利用各种平台和形式推出权威的科普内容，打响了一场科学防控保卫战。兵贵神速，让科学抢占高地中国科技出版社人的科学防疫号角，在春节期间就吹起了。面对突如其来的疫情，中国科技出版社党委统一部署，立即成立疫情应急工作小组，指导各项工作。生活健康编辑部、大众科普编辑部、医学编辑部、少儿科普编辑部等多个部门迅速召集业务骨干，策划《科学防护战“疫”必胜》科普折页和《科学防护“疫”问医答》科普挂图的编辑出版工作。周少敏、符晓静、赵晖、李洁、焦健姿、崔玲、薛红玉、马宇晨、胡萍、王晓平、齐放、黄维佳、肖静、刘茜、李睿等同志放弃春节假期，立刻投入到紧张有序的工作中。他们连夜赶出了设计文件，寻求印厂的支持，保质保量完成了任务。2月3日，北京市东城区和平里街道民旺社区成为第一批收到该折页和挂图的社区之一。与此同时，15万份折页、5万套挂图连夜印刷完毕，陆续通过各地方科协下发基层，在科学抗疫过程中发挥作用。为帮助小朋友们认识疫情，做好科学防护，由大众科普编辑部牵头，在最短时间内编辑出版了公益科普绘本电子书――《科学开开门：给小朋友们的新型冠状病毒感染防护绘本》。赵晖、郑洪炜、焦健姿、李洁、张敬一、黄维佳等多名同志日夜奋战，快速完成了稿件修改、专家审核、书号申领、排版设计等工作。科学大观园编辑部程建兰同志克服家庭困难，春节假期全时在岗，与团队一起出版了抗击疫情的专刊《举国抗疫》，每天还参与科界App内容编发并承担中国科技出版社抗疫防疫工作日报编写制作工作。,http://www.cast.org.cn/art/2020/2/14/art_80_112378.html
科协人战“疫”时刻，新冠战“疫”中的科普尖兵,新增确诊人数：259、444、769、1771、2102、2590、3235、3887…… 这不是一串冰冷的数字，这是一条条鲜活的生命。 武汉、湖北、中国。在960万平方公里的土地上，庚子年春节的喜庆被阴霾笼罩。 那不断攀升的新增确诊人数的红色曲线，像红色警报一次次在人们心中拉响；疫情迅速蔓延，全国各地、世界各地，都闪现疫魔的阴影。 武汉危急！湖北危急！ 一场没有硝烟的战争正在打响！ 值此万分危急时刻，在以习近平同志为核心的党中央坚强领导下，全国各族人民迅速行动起来，汇聚起众志成城、万众一心的强大力量，东西南北、各行各业都积极投身到这场没有硝烟的战“疫”中。 在这些抗“疫”军团中，有一支中国科协的科普尖兵。他们用科学为人民筑起防护墙，用知识斩断谣言的传播。 疫魔当前 科普亮剑 病毒是看不见的魔鬼，在肆虐的疫情面前，如何科学救治、如何科学防控、如何科学生活、如何判别谣言与真相…… 越是紧急时刻，科普越发重要。人民需要知识、社会需要科普。 自2019年12月下旬网上出现不明原因肺炎信息开始，中国科协第一时间做好科普引导，同时指导湖北省科协开展应急科普工作。截至1月22日春节放假前，科普中国、科学辟谣、中国数字科技馆等平台发布“预防新型冠状病毒感染”文章的总浏览量超过1.2亿。 为落实习近平总书记和党中央关于新冠肺炎疫情防控重要部署，在中国科协党组书记处领导下，中国科协办公厅1月22日印发《关于开展新型冠状病毒感染的肺炎疫情应急科普工作的通知》，成立中国科协应急科普领导小组，各部门、各单位迅速行动起来，充分发挥大联合大协作的协同优势、科协系统组织动员优势和科技工作者专业优势，积极主动配合有关部门和地方加强疫情防控开展应急科普。 截至2月13日，中国科协通过官网、今日科协、科普中国、科学辟谣、科界、数字科技馆、返朴、知识就是力量、科学大观园、绿平台等平台和各类新媒体，持续普及疫情防控知识、开展科学辟谣，共刊发相关内容报道16646篇，音视频619个，主持和维护微博话题40个，总浏览量超41.1亿。,http://www.cast.org.cn/art/2020/2/14/art_80_112379.html
湖北：县级科协自觉担当科学抗疫“生力军”,抗击新冠肺炎，防控重于治疗。特别是对于医疗资源相比城市更加缺乏的县乡村，切实提高基层群众、农村居民的科学防控能力尤为重要。连日来，湖北省各县（市、区）科协面对广大人民群众防控疫情的科普需求，自觉担当作为，发挥好基层“科普工作第一站”职能作用，采取多种措施办法，下功夫做好距离城镇社区居民、农民群众“最后一公里”的科普服务。武汉市作为新冠肺炎高发地，各区科协在所辖街乡、社区、村、科普教育基地等迅速发布防控通知，及时在辖区内科普画廊、宣传栏、电子显示屏、全媒体科普视窗更新宣传播放防控新冠肺炎的科普宣传资料，在各地科协网站转发“科普中国”视频，发动辖区居民踊跃参与武汉科技报组织开展的预防新冠肺炎专题网络科普知识竞答活动。东西湖区科协工作人员每天分早晚两班轮流深入社区，联合科技志愿者拉横幅、张贴科普宣传单进行科普宣传。新洲区科协及时发布“科普中国”“今日科协”和“新洲科普”等微信公众号的内容，号召各街镇科协微信公众号转发，推送有针对性的科普防疫信息，通过村村响广播、移动音箱、录音小喇叭、敲锣广而告之、疫情防控科普宣传单、电子显示屏、横幅等多种形式做好疫情防控宣传。蔡甸区科协着力发挥“三长”作用，让防疫科普知识随时服务于群众。区属桐湖卫生院党支部书记、院长、兼职科协副主席高英明不顾自身患有高血压、疱疹等疾病，坚持指挥、服务在前，积极对接配合区卫健局和桐湖办事处指挥部，协调争取到大量防护物资，为医疗防控工作创造条件。襄阳市各县市区科协干部职工通过微信或QQ工作群、朋友圈等各种方式，及时传达落实上级关于防控新冠肺炎工作的精神，转发“科普中国”“今日科协”等官方科普信息，倡导科学防疫。襄城区科普示范社区――中山巷社区发挥科普示范社区引领带头作用，全面加强疫情防控科普知识宣传，及时准确传达有关政策和预防信息。借助网站、微信、QQ等渠道，用群众易于理解的方式，向社会公众普及防治新型冠状病毒感染的科学态度、科学知识、科学方法，引导群众正确理解、积极配合、科学参与疫情防控，不断增强自我保护意识。通过组建社区居民微信群，及时了解群众需求，为确诊患者和疑似患者做好贴心服务，赢得了居民群众的广泛支持和点赞。2月5日，中央电视台《新闻直播间》播出了《战疫情・社区防控――疫情挡不住的社区温情》，对该社区开展科学防疫工作进行了报道。,http://www.cast.org.cn/art/2020/2/14/art_80_112377.html
科协人战“疫”时刻，这次一起做战士,“朋友昨天还劝我，不要在这个时候冒风险，可越是这种时期，越是要妥善处置野生动物。”一场突如其来的疫情，让坚守工作成了中国野生动物保护协会志愿者委员会委员、青岛市城阳区野生动植物保护协会会长徐立强的春节假期的唯一旋律。大年初二至今，徐立强一直冒着刺骨寒风，戴着防护装备，坚持进行栖息地巡护行动，并向周边居民介绍非法猎捕、饲养、食用野生动物的危害，发放野生动物保护的科普宣传手册。“我是一名共产党员，越是艰难时，越是不能退缩。”徐立强只是全国学会坚决贯彻党中央关于疫情防控各项决策部署，抗击新冠肺炎疫情的一个缩影，也是全国学会党组织战斗堡垒里的一名普通“战士”。战斗堡垒中共中央总书记习近平1月27日作出重要指示强调，各级党委要在这场严峻斗争的实践中考察识别干部，激励引导广大党员、干部在危难时刻挺身而出、英勇奋斗、扎实工作，经受住考验，紧紧依靠人民群众坚决打赢疫情防控阻击战。中国科协及全国学会向全国科技工作者发出倡议：战“疫”有我，为决胜攻坚提供科技志愿服务。中国科协党组在传达学习习近平总书记重要讲话精神、研究部署疫情防控工作时强调，要增强科协系统各级党组织政治功能，发挥基层科协、学会党组织在重大任务落实中的战斗堡垒作用，切实把政治优势组织优势有效转化为治理效能。全国学会党组织积极行动起来，充分发挥出战斗堡垒作用。中国声学学会在公众号上发布《中国声学学会党委关于抗击新冠肺炎疫情致广大声学科技工作者的倡议书》。中国粮油学会理事会党委发出《关于抗击疫情发挥党组织和党员示范引领作用的倡议书》，要求所属党组织和全体党员会员，从我做起，从身边做起，积极参与到新型冠状病毒感染的肺炎防控中，坚定信心、同舟共济、科学防治、携手抗击，打赢这场疫情防控阻击战。中国科学技术期刊编辑学会党委积极发挥学会资源优势，引导会员单位期刊投身疫情防控阻击战。《中国科学院院刊》、《医学新知》权威、客观地传播正能量，为疫情防控建言献策。,http://www.cast.org.cn/art/2020/2/14/art_80_111988.html
